{
  "id": "item-abc123",
  "sku": "UO-BRAND-001",
  "name": "Urban Outfitters Product",
  "description": "Sample product description",
  "price": 29.0,
  "currency": "USD",
  "category": "womens",
  "status": "active",
  "inventoryQuantity": 10,
  "imageUrls": [
    "https://example.com/image.jpg"
  ]
}